{
  "$schema": "../schemas/entity.json",
  "entity_id": "aayush",
  "display_name": "Aayush Kumar Gupta",
  "self_patterns": [
    "AAYUSH\\s*KUMAR\\s*GUPT(A)?",
    "AAYUSH\\s*GUPT(A)?",
    "\\bAAYUSH\\b"
  ],
  "self_vpas": [
    "aayush20g",
    "9594435259"
  ],
  "family_members": [
    {
      "name": "Sunita Gupta",
      "relationship": "Mother",
      "account_head": "Sunita Gupta",
      "patterns": ["SUNITA\\s*GUPT(A)?", "\\bSUNITA\\b"]
    },
    {
      "name": "Ajay Gupta",
      "relationship": "Father",
      "account_head": "Ajay Gupta",
      "patterns": ["AJAY\\s*KUMAR\\s*GUPT(A)?", "AJAY\\s*GUPT(A)?", "\\bAKG\\b"]
    },
    {
      "name": "Archit Gupta",
      "relationship": "Brother",
      "account_head": "Archit Gupta",
      "patterns": ["ARCHIT\\s*GUPT(A)?", "\\bARCHIT\\b"]
    },
    {
      "name": "Megha Gupta",
      "relationship": "Sister",
      "account_head": "Megha Gupta",
      "patterns": ["MEGHA\\s*GUPT?A?", "\\bMEGHA\\b", "meghaghati", "\\bMiss\\.?\\s*MEG[H]?\\b"]
    },
    {
      "name": "Ajay Gupta HUF",
      "relationship": "HUF",
      "account_head": "Ajay Gupta HUF",
      "patterns": ["\\bHUF\\b|\\bH\\.U\\.F\\.\\b|AJAY\\s*GUPTA\\s*HUF"]
    }
  ],
  "rent": {
    "landlords": ["NELABALLI", "NAGARAJ A", "MOHITH\\s*(S\\s*)?REDDY"],
    "vpas": ["4897690162095"],
    "keywords": ["PG FEES", "PG RENT", "\\bRENT\\b"]
  },
  "custom_rules": [
    {
      "label": "Salary",
      "account_head": "Salary",
      "pattern": "^TRANS$",
      "exact_amount": 9109,
      "direction": "cr",
      "confidence": 0.90
    },
    {
      "label": "Contra - SBI",
      "account_head": "SBI 1227",
      "layer": "common",
      "patterns_all": ["\\bAAYUSH\\b", "STATE\\s*BANK\\s*OF\\s*INDIA|SBI\\b|SBIN"],
      "confidence": 0.90
    },
    {
      "label": "Contra - Kotak",
      "account_head": "KOTAK 0333",
      "layer": "common",
      "patterns_all": ["\\bAAYUSH\\b", "KOTAK\\b|KKBK"],
      "confidence": 0.90
    },
    {
      "label": "Contra - Jupiter",
      "account_head": "FEDERAL 0847",
      "layer": "common",
      "patterns_all": ["\\bAAYUSH\\b", "JUPITER|FEDERAL\\b|FDRL"],
      "confidence": 0.90
    },
    {
      "label": "Contra - Axis",
      "account_head": "Axis",
      "layer": "common",
      "patterns_all": ["\\bAAYUSH\\b", "AXIS\\b|UTIB"],
      "confidence": 0.90
    },
    {
      "label": "Contra - HDFC",
      "account_head": "HDFC 5413",
      "layer": "common",
      "patterns_all": ["\\bAAYUSH\\b", "HDFC"],
      "exclude_pattern": "HDFC\\s*SECURITIES|HDBFSS|HDFCLIFE|HDFC\\s*MF|HDFC\\s*MUTUAL\\s*FUND|HDFCMF",
      "confidence": 0.90
    },
    {
      "label": "Contra - SBM",
      "account_head": "SBM",
      "layer": "common",
      "patterns_all": ["\\bAAYUSH\\b", "SBM\\b|STCB"],
      "confidence": 0.90
    }
  ],
  "output_sheet_names": ["For Tally", "Conso", "Bank Summary", "Monthly Pivot", "Guidelines"],
  "accounts": [
    {
      "account_key": "hdfc",
      "bank": "hdfc",
      "account_id": "HDFC 5413",
      "sheet_name": "HDFC 5413",
      "display_name": "HDFC Bank",
      "meta_signals_extra": ["5413"]
    },
    {
      "account_key": "kotak",
      "bank": "kotak",
      "account_id": "KOTAK 0333",
      "sheet_name": "KOTAK 0333",
      "display_name": "Kotak Mahindra Bank",
      "meta_signals_extra": ["0333"]
    },
    {
      "account_key": "sbi",
      "bank": "sbi",
      "account_id": "SBI 1227",
      "sheet_name": "SBI 1227",
      "display_name": "State Bank of India",
      "meta_signals_extra": ["1227", "SHIVAJI NAGAR"]
    },
    {
      "account_key": "federal",
      "bank": "federal",
      "account_id": "FEDERAL 0847",
      "sheet_name": "FEDERAL 0847",
      "display_name": "Federal Bank (Jupiter)",
      "meta_signals_extra": ["0847", "77770101840847"]
    },
    {
      "account_key": "axis",
      "bank": "axis",
      "account_id": "AXIS",
      "sheet_name": "AXIS",
      "display_name": "Axis Bank"
    },
    {
      "account_key": "sbm",
      "bank": "sbm",
      "account_id": "SBM",
      "sheet_name": "SBM",
      "display_name": "SBM Bank"
    }
  ]
}
