{
  "$schema": "../schemas/entity.json",
  "entity_id": "sunita",
  "display_name": "Sunita Gupta",
  "self_patterns": [
    "SUNITA\\s*GUPT(A)?",
    "\\bSUNITA\\b"
  ],
  "self_vpas": [],
  "family_members": [
    {
      "name": "Ajay Gupta",
      "relationship": "Spouse",
      "account_head": "Ajay Gupta",
      "patterns": ["AJAY\\s*KUMAR\\s*GUPT(A)?", "AJAY\\s*GUPT(A)?", "\\bAKG\\b"]
    },
    {
      "name": "Aayush Gupta",
      "relationship": "Son",
      "account_head": "Aayush Gupta",
      "patterns": ["AAYUSH\\s*GUPT(A)?", "\\bAAYUSH\\b"]
    },
    {
      "name": "Archit Gupta",
      "relationship": "Son",
      "account_head": "Archit Gupta",
      "patterns": ["ARCHIT\\s*GUPT(A)?", "\\bARCHIT\\b"]
    },
    {
      "name": "Megha Gupta",
      "relationship": "Daughter-in-law",
      "account_head": "Megha Gupta",
      "patterns": ["MEGHA\\s*GUPT?A?", "\\bMEGHA\\b", "meghaghati"]
    },
    {
      "name": "Ajay Gupta HUF",
      "relationship": "HUF",
      "account_head": "Ajay Gupta HUF",
      "patterns": ["\\bHUF\\b|\\bH\\.U\\.F\\.\\b|AJAY\\s*GUPTA\\s*HUF"]
    }
  ],
  "rent": {
    "landlords": [],
    "vpas": [],
    "keywords": []
  },
  "custom_rules": [],
  "output_sheet_names": [
    "For Tally",
    "Conso",
    "Bank Summary",
    "Monthly Pivot",
    "Guidelines"
  ],
  "accounts": [
    {
      "account_key": "hdfc",
      "bank": "hdfc",
      "account_id": "HDFC 0094",
      "sheet_name": "HDFC 0094",
      "display_name": "HDFC Bank",
      "meta_signals_extra": ["0094"]
    },
    {
      "account_key": "kotak",
      "bank": "kotak",
      "account_id": "KOTAK 0333",
      "sheet_name": "KOTAK 0333",
      "display_name": "Kotak Mahindra Bank",
      "meta_signals_extra": ["0333"]
    },
    {
      "account_key": "axis",
      "bank": "axis",
      "account_id": "AXIS",
      "sheet_name": "AXIS",
      "display_name": "Axis Bank"
    },
    {
      "account_key": "sbi",
      "bank": "sbi",
      "account_id": "SBI",
      "sheet_name": "SBI",
      "display_name": "State Bank of India"
    }
  ]
}
