{
  "$schema": "../schemas/entity.json",
  "entity_id": "ajay",
  "display_name": "Ajay Gupta",
  "self_patterns": [
    "AJAY\\s*KUMAR\\s*GUPT(A)?",
    "AJAY\\s*GUPT(A)?",
    "\\bAKG\\b"
  ],
  "self_vpas": [],
  "family_members": [
    {
      "name": "Sunita Gupta",
      "relationship": "Spouse",
      "account_head": "Sunita Gupta",
      "patterns": ["SUNITA\\s*GUPT(A)?", "\\bSUNITA\\b"]
    },
    {
      "name": "Aayush Gupta",
      "relationship": "Son",
      "account_head": "Aayush Gupta",
      "patterns": ["AAYUSH\\s*GUPT(A)?", "\\bAAYUSH\\b"]
    },
    {
      "name": "Archit Gupta",
      "relationship": "Son",
      "account_head": "Archit Gupta",
      "patterns": ["ARCHIT\\s*GUPT(A)?", "\\bARCHIT\\b"]
    },
    {
      "name": "Megha Gupta",
      "relationship": "Daughter-in-law",
      "account_head": "Megha Gupta",
      "patterns": ["MEGHA\\s*GUPT?A?", "\\bMEGHA\\b", "meghaghati"]
    },
    {
      "name": "Ajay Gupta HUF",
      "relationship": "HUF",
      "account_head": "Ajay Gupta HUF",
      "patterns": ["\\bHUF\\b|\\bH\\.U\\.F\\.\\b|AJAY\\s*GUPTA\\s*HUF"]
    }
  ],
  "rent": {
    "landlords": [],
    "vpas": [],
    "keywords": []
  },
  "custom_rules": [
    {
      "label": "Society Maintenance",
      "account_head": "Society Maintenance",
      "pattern": "PARADISE|MAINT",
      "direction": "DR",
      "confidence": 0.90
    },
    {
      "label": "Ishwar",
      "account_head": "Ishwar",
      "pattern": "ISHWAR",
      "direction": "ANY",
      "confidence": 0.85
    }
  ],
  "output_sheet_names": [
    "For Tally",
    "Conso",
    "Bank Summary",
    "Salary",
    "Leave Encashment",
    "Contra Summary",
    "EquityRelated",
    "Monthly Pivot",
    "Guidelines"
  ],
  "accounts": [
    {
      "account_key": "hdfc",
      "bank": "hdfc",
      "account_id": "HDFC 5930",
      "sheet_name": "HDFC 5930",
      "display_name": "HDFC Bank",
      "meta_signals_extra": ["5930"]
    },
    {
      "account_key": "axis",
      "bank": "axis",
      "account_id": "AXIS 3167",
      "sheet_name": "AXIS 3167",
      "display_name": "Axis Bank",
      "meta_signals_extra": ["3167"]
    },
    {
      "account_key": "boi",
      "bank": "boi",
      "account_id": "BOI 6699",
      "sheet_name": "BOI 6699",
      "display_name": "Bank of India",
      "meta_signals_extra": ["BKID", "662113100016699", "6699"]
    },
    {
      "account_key": "sbi_ca",
      "bank": "sbi",
      "account_id": "SBI Current Account",
      "sheet_name": "SBI CA",
      "display_name": "SBI Current Account",
      "meta_signals_extra": ["Current Account", "Drawing Power"]
    },
    {
      "account_key": "sbi_od",
      "bank": "sbi",
      "account_id": "SBI OD 5441",
      "sheet_name": "SBI OD 5441",
      "display_name": "SBI OD 5441",
      "meta_signals_extra": ["5441", "OD", "OVERDRAFT"]
    },
    {
      "account_key": "sbi_nsk",
      "bank": "sbi",
      "account_id": "SBI SB Nsk",
      "sheet_name": "SBI SB Nsk",
      "display_name": "SBI Saving Nashik",
      "meta_signals_extra": ["Nashik", "Nsk"]
    },
    {
      "account_key": "sbi_kota",
      "bank": "sbi",
      "account_id": "SBI SB Kota",
      "sheet_name": "SBI SB Kota",
      "display_name": "SBI Saving Kota",
      "meta_signals_extra": ["Kota"]
    },
    {
      "account_key": "sbi_rawatbhata",
      "bank": "sbi",
      "account_id": "SBI SB Rawatbhata",
      "sheet_name": "SBI SB Rawatbhata",
      "display_name": "SBI Saving Rawatbhata",
      "meta_signals_extra": ["rawatbhata"]
    },
    {
      "account_key": "sbi_ins_loan",
      "bank": "sbi",
      "account_id": "SBI Insurance Loan",
      "sheet_name": "SBI Insurance Loan",
      "display_name": "SBI Insurance Loan Nashik",
      "meta_signals_extra": ["Insurance loan"]
    },
    {
      "account_key": "sbi_flat_ins",
      "bank": "sbi",
      "account_id": "Ajay SBI Flat Insurance",
      "sheet_name": "SBI Flat Insurance Account",
      "display_name": "SBI Flat Insurance Account",
      "meta_signals_extra": ["Flat Insurance"]
    },
    {
      "account_key": "sbi_bank_3479",
      "bank": "sbi",
      "account_id": "SBI Bank 3479",
      "sheet_name": "SBI Bank 3479",
      "display_name": "SBI Bank 3479",
      "meta_signals_extra": ["3479"]
    },
    {
      "account_key": "huf_ca",
      "bank": "huf",
      "account_id": "HUF Current Account",
      "sheet_name": "HUF Current",
      "display_name": "Ajay HUF Current Account",
      "meta_signals_extra": ["HUF", "OpTransactionHistory"]
    }
  ]
}
