{
  "$schema": "../schemas/entity.json",
  "entity_id": "test",
  "display_name": "Test Entity",
  "self_patterns": ["TEST\\s*ENTITY"],
  "self_vpas": [],
  "family_members": [],
  "rent": {
    "landlords": [],
    "vpas": [],
    "keywords": []
  },
  "custom_rules": [],
  "output_sheet_names": ["For Tally", "Conso", "Bank Summary"],
  "accounts": [
    {
      "account_key": "hdfc",
      "bank": "hdfc",
      "account_id": "123456789",
      "sheet_name": "HDFC",
      "display_name": "HDFC Bank"
    }
  ]
}